{
  "schemaVersion": 1,
  "reportId": "c9c467cc-65c4-8ff1-e175-4af42f2ed545",
  "validatorVersion": "feasibility-v1",
  "itineraryFingerprint": "aaaaaaaaaaaaaaaaaaaaaaaaaaaaaaaaaaaaaaaaaaaaaaaaaaaaaaaaaaaaaaaa",
  "status": "VERIFIED",
  "validatedAt": "2026-08-09T12:00:00Z",
  "requiredRuleIds": [
    "OPENING_HOURS"
  ],
  "missingRequiredRuleIds": [],
  "summary": {
    "totalCount": 1,
    "passCount": 1,
    "failCount": 0,
    "unknownCount": 0,
    "notApplicableCount": 0,
    "missingRequiredCount": 0
  },
  "ruleResults": [
    {
      "ruleId": "OPENING_HOURS",
      "ruleVersion": "1",
      "outcome": "PASS",
      "reasonCode": "REASON_OK",
      "message": "ok",
      "affectedDates": [],
      "affectedEntityRefs": [],
      "repairable": false,
      "evidenceRefs": [
        {
          "evidenceId": "ev-oh-1",
          "evidenceType": "OPENING_HOURS",
          "state": "VERIFIED",
          "hardConstraintEligible": true
        }
      ]
    }
  ],
  "repairAttempts": [
    {
      "attemptIndex": 1,
      "triggeringRuleIds": [
        "OPENING_HOURS"
      ],
      "actionCodes": [
        "MOVE"
      ],
      "affectedDates": [],
      "affectedEntityRefs": [],
      "beforeFingerprint": "aaaaaaaaaaaaaaaaaaaaaaaaaaaaaaaaaaaaaaaaaaaaaaaaaaaaaaaaaaaaaaaa",
      "afterFingerprint": "aaaaaaaaaaaaaaaaaaaaaaaaaaaaaaaaaaaaaaaaaaaaaaaaaaaaaaaaaaaaaaaa",
      "resultingStatus": "VERIFIED"
    },
    {
      "attemptIndex": 3,
      "triggeringRuleIds": [
        "OPENING_HOURS"
      ],
      "actionCodes": [
        "MOVE"
      ],
      "affectedDates": [],
      "affectedEntityRefs": [],
      "beforeFingerprint": "aaaaaaaaaaaaaaaaaaaaaaaaaaaaaaaaaaaaaaaaaaaaaaaaaaaaaaaaaaaaaaaa",
      "afterFingerprint": "aaaaaaaaaaaaaaaaaaaaaaaaaaaaaaaaaaaaaaaaaaaaaaaaaaaaaaaaaaaaaaaa",
      "resultingStatus": "VERIFIED"
    }
  ]
}