{
  "schemaVersion": 1,
  "reportId": "c9c467cc-65c4-8ff1-e175-4af42f2ed545",
  "validatorVersion": "feasibility-v1",
  "itineraryFingerprint": "aaaaaaaaaaaaaaaaaaaaaaaaaaaaaaaaaaaaaaaaaaaaaaaaaaaaaaaaaaaaaaaa",
  "status": "UNVERIFIED",
  "validatedAt": "2026-08-09T12:00:00Z",
  "requiredRuleIds": [
    "OPENING_HOURS",
    "TRANSIT"
  ],
  "missingRequiredRuleIds": [
    "TRANSIT"
  ],
  "summary": {
    "totalCount": 1,
    "passCount": 1,
    "failCount": 0,
    "unknownCount": 0,
    "notApplicableCount": 0,
    "missingRequiredCount": 1
  },
  "ruleResults": [
    {
      "ruleId": "OPENING_HOURS",
      "ruleVersion": "1",
      "outcome": "PASS",
      "reasonCode": "REASON_OK",
      "message": "ok",
      "affectedDates": [],
      "affectedEntityRefs": [],
      "evidenceRefs": [
        {
          "evidenceId": "ev-oh-1",
          "evidenceType": "OPENING_HOURS",
          "state": "VERIFIED",
          "hardConstraintEligible": true
        }
      ],
      "repairable": false
    }
  ],
  "repairAttempts": []
}