{
  "schemaVersion": 1,
  "reportId": "c9c467cc-65c4-8ff1-e175-4af42f2ed545",
  "validatorVersion": "feasibility-v1",
  "itineraryFingerprint": "aaaaaaaaaaaaaaaaaaaaaaaaaaaaaaaaaaaaaaaaaaaaaaaaaaaaaaaaaaaaaaaa",
  "status": "UNVERIFIED",
  "validatedAt": "2026-08-09T12:00:00Z",
  "requiredRuleIds": [
    "OPENING_HOURS"
  ],
  "missingRequiredRuleIds": [],
  "summary": {
    "totalCount": 1,
    "passCount": 0,
    "failCount": 0,
    "unknownCount": 1,
    "notApplicableCount": 0,
    "missingRequiredCount": 0
  },
  "ruleResults": [
    {
      "ruleId": "OPENING_HOURS",
      "ruleVersion": "1",
      "outcome": "UNKNOWN",
      "reasonCode": "REASON_OK",
      "message": "unknown",
      "affectedDates": [],
      "affectedEntityRefs": [],
      "evidenceRefs": [
        {
          "evidenceId": "ev-oh-1",
          "evidenceType": "OPENING_HOURS",
          "state": "UNKNOWN",
          "hardConstraintEligible": false
        }
      ],
      "repairable": false
    }
  ],
  "repairAttempts": []
}